{
  "_contract": {
    "artifact_type": "verdict",
    "contract_version": "2.0.0",
    "truthcore_version": "0.2.0",
    "created_at": "2026-01-31T12:00:00Z",
    "schema": "schemas/verdict/v2.0.0/verdict.schema.json"
  },
  "verdict": "FAIL",
  "value": 15,
  "confidence": 1.0,
  "items": [
    {
      "id": "refusal-pol-001",
      "severity": "BLOCKER",
      "message": "[POLICY_VIOLATION_SECURITY] Security policy violation: Secret found in build output",
      "category": "security",
      "engine": "policy_engine",
      "confidence": 1.0,
      "metadata": {
        "refusal": {
          "code": "POLICY_VIOLATION_SECURITY",
          "details": {
            "policy_id": "secrets-detection",
            "violation": "Secret found in build output"
          },
          "remediation": "Address security issues or request policy override"
        },
        "correlation_id": "corr-jf-2026-004",
        "pipeline_stages_completed": ["jobforge", "runner", "truthcore"],
        "policy_violation": true
      }
    },
    {
      "id": "refusal-pol-002",
      "severity": "BLOCKER",
      "message": "[POLICY_VIOLATION_COMPLIANCE] Compliance violation: Unapproved third-party dependency detected",
      "category": "compliance",
      "engine": "policy_engine",
      "confidence": 1.0,
      "metadata": {
        "refusal": {
          "code": "POLICY_VIOLATION_COMPLIANCE",
          "details": {
            "policy_id": "approved-dependencies",
            "violation": "Unapproved third-party dependency detected"
          }
        }
      }
    },
    {
      "id": "policy-003",
      "severity": "HIGH",
      "message": "License compliance check failed: GPL-3.0 dependency in commercial project",
      "category": "compliance",
      "engine": "license_scanner",
      "confidence": 0.95,
      "points": 50
    }
  ],
  "metadata": {
    "scenario": "jobforge_runner_refusal_policy_violation",
    "description": "Refusal case: Policy violations detected in jobforge->runner pipeline output trigger truthcore refusal",
    "pipeline": {
      "stages": ["jobforge", "runner", "truthcore"],
      "correlation_id": "corr-jf-2026-004",
      "refusal_reasons": [
        {
          "code": "POLICY_VIOLATION_SECURITY",
          "stage": "truthcore"
        },
        {
          "code": "POLICY_VIOLATION_COMPLIANCE",
          "stage": "truthcore"
        }
      ],
      "policy_violations": ["secrets-detection", "approved-dependencies"]
    }
  }
}
