{
  "_contract": {
    "artifact_type": "verdict",
    "contract_version": "2.0.0",
    "truthcore_version": "0.2.0",
    "engine_versions": {
      "readiness": "1.0.0",
      "invariants": "1.0.0"
    },
    "created_at": "2026-01-31T00:00:00Z",
    "schema": "schemas/verdict/v2.0.0/verdict.schema.json"
  },
  "verdict": "PASS",
  "value": 95.0,
  "confidence": 0.92,
  "items": [
    {
      "id": "finding-001",
      "severity": "LOW",
      "message": "Minor code style issue",
      "category": "style",
      "engine": "readiness",
      "confidence": 0.95
    }
  ],
  "evidence_refs": [],
  "metadata": {
    "mode": "PR",
    "total_checks": 10
  }
}
