{
  "_contract": {
    "artifact_type": "verdict",
    "contract_version": "2.0.0",
    "truthcore_version": "0.2.0",
    "created_at": "2026-01-31T12:00:00Z",
    "schema": "schemas/verdict/v2.0.0/verdict.schema.json"
  },
  "verdict": "FAIL",
  "value": 5,
  "confidence": 1.0,
  "items": [
    {
      "id": "refusal-reason-001",
      "severity": "BLOCKER",
      "message": "[POLICY_VIOLATION_COMPLIANCE] Deterministic refusal: Multiple policy violations detected with full reasoning trace",
      "category": "compliance",
      "engine": "policy_reasoning_engine",
      "confidence": 1.0,
      "metadata": {
        "refusal": {
          "code": "POLICY_VIOLATION_COMPLIANCE",
          "details": {
            "policy_id": "compliance-refusal",
            "reasoning_chain": [
              "Policy 'data-retention' evaluated: DENY (matched=true, conditions_met=false)",
              "Policy 'gdpr-compliance' evaluated: DENY (matched=true, conditions_met=true)",
              "Policy 'audit-trail' evaluated: CONDITIONAL (matched=true, conditions_met=partial)",
              "Conflict resolution: Highest priority DENY selected"
            ],
            "deterministic": true,
            "explainable": true
          },
          "remediation": "Review compliance requirements and address policy conditions"
        },
        "policy_evidence": {
          "finding_id": "refusal-reason-001",
          "policy_id": "gdpr-compliance",
          "rule_id": "personal-data-protection",
          "policy_effect": "deny",
          "decision_trace": {
            "decisions": [
              {
                "policy_id": "data-retention",
                "rule_id": "retention-period-check",
                "effect": "deny",
                "priority": "HIGH",
                "matched": true,
                "conditions_met": false,
                "is_effective": false,
                "metadata": {
                  "condition_failure": "retention_period_expired",
                  "required": "365_days",
                  "actual": "730_days"
                }
              },
              {
                "policy_id": "gdpr-compliance",
                "rule_id": "personal-data-protection",
                "effect": "deny",
                "priority": "CRITICAL",
                "matched": true,
                "conditions_met": true,
                "is_effective": true,
                "metadata": {
                  "violation_type": "insufficient_consent",
                  "affected_records": 1523
                }
              },
              {
                "policy_id": "audit-trail",
                "rule_id": "complete-audit-required",
                "effect": "conditional",
                "priority": "HIGH",
                "matched": true,
                "conditions_met": false,
                "is_effective": false,
                "metadata": {
                  "missing_entries": 47,
                  "required_fields": ["timestamp", "user_id", "action", "result"]
                }
              }
            ],
            "final_effect": "deny",
            "final_policy_id": "gdpr-compliance",
            "conflicts_detected": [],
            "overrides_applied": [],
            "effective_decisions_count": 1
          },
          "conditions": [
            {
              "field": "consent_status",
              "operator": "eq",
              "value": "explicit"
            },
            {
              "field": "data_classification",
              "operator": "in",
              "value": ["personal", "sensitive"]
            }
          ],
          "override_applied": null,
          "refusal_reason": "GDPR compliance violation: insufficient consent for personal data processing"
        },
        "correlation_id": "corr-refusal-2026-002",
        "pipeline_stages_completed": ["policy_evaluation", "reasoning", "truthcore"],
        "policy_violation": true,
        "reasoning": {
          "complete_trace": true,
          "all_conditions_evaluated": true,
          "deterministic": true,
          "explanation_available": true
        }
      }
    }
  ],
  "metadata": {
    "scenario": "refusal_reasoning_deterministic",
    "description": "Refusal scenario with complete deterministic reasoning chain showing policy evaluation steps",
    "pipeline": {
      "stages": ["policy_evaluation", "reasoning", "truthcore"],
      "correlation_id": "corr-refusal-2026-002",
      "refusal_reasons": [
        {
          "code": "POLICY_VIOLATION_COMPLIANCE",
          "stage": "truthcore"
        }
      ],
      "policy_violations": ["gdpr-compliance", "data-retention", "audit-trail"],
      "reasoning_depth": "full"
    },
    "determinism_verified": true,
    "explainability": {
      "decision_trace_available": true,
      "all_evaluation_steps_documented": true,
      "condition_results_included": true,
      "refusal_reason_clear": true
    }
  }
}
