{
  "_contract": {
    "artifact_type": "verdict",
    "contract_version": "2.0.0",
    "truthcore_version": "0.2.0",
    "engine_versions": {
      "readiness": "1.0.0",
      "policy": "1.0.0"
    },
    "created_at": "2026-01-31T12:00:00Z",
    "schema": "schemas/verdict/v2.0.0/verdict.schema.json"
  },
  "verdict": "PASS",
  "value": 95,
  "confidence": 0.94,
  "items": [
    {
      "id": "style-001",
      "severity": "INFO",
      "message": "Code is well-documented with comprehensive docstrings",
      "category": "documentation",
      "engine": "readiness",
      "confidence": 0.95
    },
    {
      "id": "quality-001",
      "severity": "LOW",
      "message": "Consider adding type hints to all function parameters",
      "category": "quality",
      "engine": "policy",
      "confidence": 0.8
    }
  ],
  "evidence_refs": ["inputs/clean_code/*.py"],
  "metadata": {
    "scenario": "clean_code",
    "description": "High quality codebase with good practices",
    "files_checked": 12,
    "tests_passing": 45
  }
}
