{
  "_contract": {
    "artifact_type": "verdict",
    "contract_version": "2.0.0",
    "truthcore_version": "0.2.0",
    "engine_versions": {
      "readiness": "1.0.0",
      "policy": "1.0.0"
    },
    "created_at": "2026-01-31T12:00:00Z",
    "schema": "schemas/verdict/v2.0.0/verdict.schema.json"
  },
  "verdict": "PASS",
  "value": 88,
  "confidence": 0.85,
  "items": [
    {
      "id": "style-001",
      "severity": "INFO",
      "message": "Line exceeds 80 characters",
      "category": "style",
      "engine": "policy",
      "source": "src/main.py:45",
      "confidence": 0.9
    },
    {
      "id": "style-002",
      "severity": "INFO",
      "message": "Missing trailing newline",
      "category": "style",
      "engine": "policy",
      "source": "src/utils.py:120",
      "confidence": 0.8
    },
    {
      "id": "style-003",
      "severity": "INFO",
      "message": "Import ordering could be improved",
      "category": "style",
      "engine": "readiness",
      "confidence": 0.75
    }
  ],
  "evidence_refs": ["inputs/style_only/*.py"],
  "metadata": {
    "scenario": "style_only",
    "description": "Code with only style/formatting issues, no functional problems",
    "style_issues": 3,
    "functional_issues": 0
  }
}
