{
  "_contract": {
    "artifact_type": "verdict",
    "contract_version": "2.0.0",
    "truthcore_version": "0.2.0",
    "created_at": "2026-01-31T12:00:00Z",
    "schema": "schemas/verdict/v2.0.0/verdict.schema.json"
  },
  "verdict": "PASS",
  "value": 95,
  "confidence": 1.0,
  "items": [
    {
      "id": "policy-override-001",
      "severity": "INFO",
      "message": "Policy override applied: Emergency patch approved via override mechanism",
      "category": "policy",
      "engine": "policy_override_resolver",
      "confidence": 1.0,
      "metadata": {
        "override": {
          "policy_id": "no-deploy-friday",
          "override_applied": true,
          "approved_by": "security-team-lead",
          "expires_at": "2026-02-01T00:00:00Z",
          "reason": "Critical security patch deployment - emergency override approved",
          "condition_met": true
        },
        "policy_evidence": {
          "finding_id": "policy-override-001",
          "policy_id": "no-deploy-friday",
          "rule_id": "friday-deployment-block",
          "policy_effect": "deny",
          "decision_trace": {
            "decisions": [
              {
                "policy_id": "no-deploy-friday",
                "rule_id": "friday-deployment-block",
                "effect": "deny",
                "priority": "MEDIUM",
                "matched": true,
                "conditions_met": true,
                "overridden_by": "emergency-override",
                "is_effective": false
              }
            ],
            "final_effect": "allow",
            "final_policy_id": "emergency-override",
            "conflicts_detected": [],
            "overrides_applied": [
              {
                "policy_id": "no-deploy-friday",
                "approved_by": "security-team-lead",
                "expires_at": "2026-02-01T00:00:00Z",
                "reason": "Critical security patch deployment - emergency override approved"
              }
            ],
            "effective_decisions_count": 0
          },
          "conditions": [],
          "override_applied": {
            "policy_id": "no-deploy-friday",
            "approved_by": "security-team-lead",
            "expires_at": "2026-02-01T00:00:00Z",
            "reason": "Critical security patch deployment - emergency override approved"
          },
          "refusal_reason": null
        },
        "correlation_id": "corr-override-2026-003",
        "pipeline_stages_completed": ["policy_evaluation", "override_check", "truthcore"],
        "policy_override": true
      }
    }
  ],
  "metadata": {
    "scenario": "policy_override_explicit",
    "description": "Policy override scenario: Legitimate override approved with full audit trail",
    "pipeline": {
      "stages": ["policy_evaluation", "override_check", "truthcore"],
      "correlation_id": "corr-override-2026-003",
      "refusal_reasons": [],
      "policy_overrides": ["no-deploy-friday"],
      "override_approval_chain": ["security-team-lead"]
    },
    "determinism_verified": true,
    "override_audit": {
      "override_active": true,
      "approved_by": "security-team-lead",
      "expiry_tracked": true,
      "justification_documented": true,
      "emergency_procedures_followed": true
    },
    "explainability": {
      "override_reasoning_available": true,
      "approval_chain_documented": true,
      "expiration_tracked": true
    }
  }
}
