{
  "_contract": {
    "artifact_type": "verdict",
    "contract_version": "2.0.0",
    "truthcore_version": "0.2.0",
    "engine_versions": {
      "policy": "1.0.0",
      "invariants": "1.0.0"
    },
    "created_at": "2026-01-31T12:00:00Z",
    "schema": "schemas/verdict/v2.0.0/verdict.schema.json"
  },
  "verdict": "FAIL",
  "value": 35,
  "confidence": 0.98,
  "items": [
    {
      "id": "security-001",
      "severity": "BLOCKER",
      "message": "Hardcoded API key detected in source code",
      "category": "security",
      "engine": "policy",
      "source": "src/config.py:15",
      "confidence": 0.99
    },
    {
      "id": "security-002",
      "severity": "BLOCKER",
      "message": "SQL injection vulnerability in user input handling",
      "category": "security",
      "engine": "policy",
      "source": "src/database.py:42",
      "confidence": 0.97
    },
    {
      "id": "security-003",
      "severity": "HIGH",
      "message": "Insecure deserialization detected",
      "category": "security",
      "engine": "policy",
      "source": "src/utils.py:88",
      "confidence": 0.92
    },
    {
      "id": "security-004",
      "severity": "HIGH",
      "message": "Missing input validation on user endpoint",
      "category": "security",
      "engine": "invariants",
      "confidence": 0.89
    }
  ],
  "evidence_refs": ["inputs/security_issues/*.py"],
  "metadata": {
    "scenario": "security_issues",
    "description": "Code with critical security vulnerabilities",
    "blockers": 2,
    "high_severity": 2
  }
}
