{
  "_contract": {
    "artifact_type": "verdict",
    "contract_version": "2.0.0",
    "truthcore_version": "0.2.0",
    "created_at": "2026-01-31T12:00:00Z",
    "schema": "schemas/verdict/v2.0.0/verdict.schema.json"
  },
  "verdict": "FAIL",
  "value": 0,
  "confidence": 1.0,
  "items": [
    {
      "id": "refusal-001",
      "severity": "BLOCKER",
      "message": "[EVIDENCE_MISSING_REQUIRED] Required evidence missing: build_artifacts, test_results",
      "category": "evidence",
      "engine": "truthcore_verifier",
      "confidence": 1.0,
      "metadata": {
        "refusal": {
          "code": "EVIDENCE_MISSING_REQUIRED",
          "details": {
            "missing_evidence": ["build_artifacts", "test_results"]
          },
          "remediation": "Provide the required evidence items and retry"
        },
        "correlation_id": "corr-jf-2026-002",
        "pipeline_stages_completed": ["jobforge", "runner"],
        "stage_failed": "truthcore"
      }
    },
    {
      "id": "refusal-002",
      "severity": "HIGH",
      "message": "Insufficient evidence quantity: 1 < 3 required evidence items of type 'verification_result'",
      "category": "evidence",
      "engine": "truthcore_verifier",
      "confidence": 0.9,
      "metadata": {
        "refusal": {
          "code": "EVIDENCE_INSUFFICIENT_QUANTITY",
          "details": {
            "required": 3,
            "actual": 1,
            "evidence_type": "verification_result"
          }
        }
      }
    }
  ],
  "metadata": {
    "scenario": "jobforge_runner_refusal_missing_evidence",
    "description": "Refusal case: Insufficient evidence from jobforge->runner pipeline prevents truthcore verification",
    "pipeline": {
      "stages": ["jobforge", "runner", "truthcore"],
      "correlation_id": "corr-jf-2026-002",
      "refusal_reasons": [
        {
          "code": "EVIDENCE_MISSING_REQUIRED",
          "stage": "truthcore"
        },
        {
          "code": "EVIDENCE_INSUFFICIENT_QUANTITY",
          "stage": "truthcore"
        }
      ]
    }
  }
}
