{
  "_contract": {
    "artifact_type": "verdict",
    "contract_version": "2.0.0",
    "truthcore_version": "0.2.0",
    "created_at": "2026-01-31T12:00:00Z",
    "schema": "schemas/verdict/v2.0.0/verdict.schema.json"
  },
  "verdict": "PASS",
  "value": 92,
  "confidence": 0.95,
  "items": [
    {
      "id": "jf-corr-001",
      "severity": "INFO",
      "message": "Correlation ID 'corr-jf-2026-001' successfully traced through jobforge->runner->truthcore pipeline",
      "category": "provenance",
      "engine": "jobforge_verifier",
      "confidence": 1.0,
      "metadata": {
        "correlation_id": "corr-jf-2026-001",
        "pipeline_stages": ["jobforge", "runner", "truthcore"],
        "source_attribution": {
          "system": "jobforge",
          "component": "collector",
          "version": "1.2.0"
        }
      }
    },
    {
      "id": "jf-src-001",
      "severity": "INFO",
      "message": "Source attribution verified: evidence collected from jobforge collector v1.2.0",
      "category": "provenance",
      "engine": "jobforge_verifier",
      "confidence": 1.0
    },
    {
      "id": "run-corr-001",
      "severity": "INFO",
      "message": "Runner stage executed with correlation ID 'corr-jf-2026-001'",
      "category": "provenance",
      "engine": "runner_executor",
      "confidence": 1.0,
      "metadata": {
        "correlation_id": "corr-jf-2026-001",
        "runner_duration_ms": 1500,
        "runner_exit_code": 0
      }
    },
    {
      "id": "tc-corr-001",
      "severity": "INFO",
      "message": "TruthCore verification completed for correlation ID 'corr-jf-2026-001'",
      "category": "provenance",
      "engine": "truthcore_verifier",
      "confidence": 0.95,
      "metadata": {
        "correlation_id": "corr-jf-2026-001",
        "verification_duration_ms": 250,
        "engines_ran": 3
      }
    },
    {
      "id": "tc-quality-001",
      "severity": "LOW",
      "message": "Code quality score 92/100 exceeds threshold of 90",
      "category": "quality",
      "engine": "readiness_engine",
      "confidence": 0.95,
      "points": 1
    }
  ],
  "metadata": {
    "scenario": "jobforge_runner_flow",
    "description": "Successful jobforge->runner->truthcore pipeline flow with correlation ID tracking and source attribution",
    "pipeline": {
      "stages": ["jobforge", "runner", "truthcore"],
      "correlation_id": "corr-jf-2026-001",
      "source_systems": ["jobforge"],
      "runner_executed": true,
      "truthcore_verified": true
    }
  }
}
