{
  "_contract": {
    "artifact_type": "verdict",
    "contract_version": "2.0.0",
    "truthcore_version": "0.2.0",
    "engine_versions": {
      "readiness": "1.0.0",
      "policy": "1.0.0"
    },
    "created_at": "2026-01-31T12:00:00Z",
    "schema": "schemas/verdict/v2.0.0/verdict.schema.json"
  },
  "verdict": "FAIL",
  "value": 42,
  "confidence": 0.91,
  "items": [
    {
      "id": "test-001",
      "severity": "BLOCKER",
      "message": "No test files found in the repository",
      "category": "testing",
      "engine": "readiness",
      "confidence": 0.99
    },
    {
      "id": "test-002",
      "severity": "HIGH",
      "message": "Critical functions lack test coverage",
      "category": "testing",
      "engine": "policy",
      "confidence": 0.95
    },
    {
      "id": "test-003",
      "severity": "MEDIUM",
      "message": "Test coverage below 50% threshold",
      "category": "testing",
      "engine": "readiness",
      "confidence": 0.88
    }
  ],
  "evidence_refs": ["inputs/missing_tests/*.py"],
  "metadata": {
    "scenario": "missing_tests",
    "description": "Codebase lacking proper test coverage",
    "test_files": 0,
    "coverage_percent": 12
  }
}
